{
  "schemaVersion": 1,
  "caseId": "heldout.api-backend-delivery.auth-authorization.production-greenfield",
  "acceptedSolutions": [
    {
      "solutionId": "enterprise-oidc-and-tenant-authorization",
      "allowedSkillIds": [
        "auth-implementation-patterns",
        "api-security-best-practices",
        "backend-security-coder",
        "saas-multi-tenant",
        "security-and-hardening"
      ],
      "requiredGroups": [
        [
          "auth-implementation-patterns"
        ],
        [
          "saas-multi-tenant"
        ],
        [
          "api-security-best-practices",
          "backend-security-coder",
          "security-and-hardening"
        ]
      ]
    }
  ],
  "ambiguous": false,
  "provenance": {
    "source": "independent-synthetic-held-out-gold",
    "version": "1.0.0",
    "reviewedAt": "2026-07-17"
  },
  "reviews": [
    {
      "reviewer": "codex-independent-alpha",
      "decision": "approved",
      "reviewedDigest": "sha256-f5d6681d547eb196e333a207dfaf0b71e705c31d63cc769ab14349605b40e753"
    },
    {
      "reviewer": "codex-independent-beta",
      "decision": "approved",
      "reviewedDigest": "sha256-f5d6681d547eb196e333a207dfaf0b71e705c31d63cc769ab14349605b40e753"
    }
  ]
}
