{
  "schemaVersion": 1,
  "caseId": "tuning.api-backend-delivery.auth-authorization.clinical-records-api",
  "acceptedSolutions": [
    {
      "solutionId": "auth-and-api-security",
      "allowedSkillIds": [
        "auth-implementation-patterns",
        "api-security-best-practices"
      ],
      "requiredGroups": [
        [
          "auth-implementation-patterns"
        ],
        [
          "api-security-best-practices"
        ]
      ]
    },
    {
      "solutionId": "auth-and-backend-hardening",
      "allowedSkillIds": [
        "auth-implementation-patterns",
        "backend-security-coder"
      ],
      "requiredGroups": [
        [
          "auth-implementation-patterns"
        ],
        [
          "backend-security-coder"
        ]
      ]
    }
  ],
  "ambiguous": false,
  "reviews": [
    {
      "reviewer": "codex-independent-alpha",
      "decision": "approved",
      "reviewedDigest": "sha256-3720a04782fd48eeae4b47e8a9613a86defb5e2964d706c78bd919c6233e0b44"
    },
    {
      "reviewer": "codex-independent-beta",
      "decision": "approved",
      "reviewedDigest": "sha256-3720a04782fd48eeae4b47e8a9613a86defb5e2964d706c78bd919c6233e0b44"
    }
  ],
  "provenance": {
    "source": "independent-synthetic-tuning-gold-authoring",
    "version": "1.0.0",
    "reviewedAt": "2026-07-17"
  }
}
