{
  "schemaVersion": 1,
  "caseId": "heldout.api-backend-delivery.api-design-contracts.production-greenfield",
  "acceptedSolutions": [
    {
      "solutionId": "production-contract-and-lifecycle",
      "allowedSkillIds": [
        "api-and-interface-design",
        "api-design-principles",
        "api-patterns",
        "openapi-spec-generation",
        "openapi-spec-generator",
        "api-documenter"
      ],
      "requiredGroups": [
        [
          "api-and-interface-design",
          "api-design-principles",
          "api-patterns"
        ],
        [
          "openapi-spec-generation",
          "openapi-spec-generator",
          "api-documenter"
        ]
      ]
    }
  ],
  "ambiguous": false,
  "provenance": {
    "source": "independent-synthetic-held-out-gold",
    "version": "1.0.0",
    "reviewedAt": "2026-07-17"
  },
  "reviews": [
    {
      "reviewer": "codex-independent-alpha",
      "decision": "approved",
      "reviewedDigest": "sha256-afce188cd70b0937a7bca3d52723bf14e7244c5a828e60b95a5df5dfd7f8b4b1"
    },
    {
      "reviewer": "codex-independent-beta",
      "decision": "approved",
      "reviewedDigest": "sha256-afce188cd70b0937a7bca3d52723bf14e7244c5a828e60b95a5df5dfd7f8b4b1"
    }
  ]
}
