{
  "schemaVersion": 1,
  "caseId": "heldout.test-qa-automation.load-performance.regulated-high-assurance",
  "acceptedSolutions": [
    {
      "solutionId": "k6-regulated-review",
      "allowedSkillIds": [
        "k6-load-testing",
        "performance-testing-review-multi-agent-review",
        "testing-qa"
      ],
      "requiredGroups": [
        [
          "k6-load-testing"
        ],
        [
          "performance-testing-review-multi-agent-review"
        ],
        [
          "testing-qa"
        ]
      ]
    }
  ],
  "ambiguous": false,
  "provenance": {
    "source": "independent-gold-authoring",
    "version": "1.0.0",
    "reviewedAt": "2026-07-17"
  },
  "reviews": [
    {
      "reviewer": "codex-independent-alpha",
      "decision": "approved",
      "reviewedDigest": "sha256-51fa02af148b2462ae16d61a32d1490d5e07471d007acf462f8fa3710633d4e9"
    },
    {
      "reviewer": "codex-independent-beta",
      "decision": "approved",
      "reviewedDigest": "sha256-51fa02af148b2462ae16d61a32d1490d5e07471d007acf462f8fa3710633d4e9"
    }
  ]
}
