{
  "schemaVersion": 1,
  "caseId": "tuning.deployment-devops.observability-sre.data-pipeline-operations",
  "acceptedSolutions": [
    {
      "solutionId": "slo-and-observability",
      "allowedSkillIds": [
        "observability-monitoring-slo-implement",
        "observability-engineer"
      ],
      "requiredGroups": [
        [
          "observability-monitoring-slo-implement"
        ],
        [
          "observability-engineer"
        ]
      ]
    },
    {
      "solutionId": "instrumentation-and-monitoring",
      "allowedSkillIds": [
        "observability-and-instrumentation",
        "observability-monitoring-monitor-setup"
      ],
      "requiredGroups": [
        [
          "observability-and-instrumentation"
        ],
        [
          "observability-monitoring-monitor-setup"
        ]
      ]
    }
  ],
  "ambiguous": false,
  "reviews": [
    {
      "reviewer": "codex-independent-alpha",
      "decision": "approved",
      "reviewedDigest": "sha256-019050b04388356f8f874cb3a1e8242c1965a9319dc1c4135e3bc1b59230252a"
    },
    {
      "reviewer": "codex-independent-beta",
      "decision": "approved",
      "reviewedDigest": "sha256-019050b04388356f8f874cb3a1e8242c1965a9319dc1c4135e3bc1b59230252a"
    }
  ],
  "provenance": {
    "source": "independent-synthetic-tuning-gold-authoring",
    "version": "1.0.0",
    "reviewedAt": "2026-07-17"
  }
}
