{
  "schemaVersion": 1,
  "caseId": "heldout.agent-mcp-development.security-operations.constrained-offline",
  "acceptedSolutions": [
    {
      "solutionId": "offline-agent-supply-chain",
      "allowedSkillIds": [
        "threat-modeling-expert",
        "security-requirement-extraction",
        "skill-scanner",
        "security-and-hardening",
        "protect-mcp-governance"
      ],
      "requiredGroups": [
        [
          "threat-modeling-expert",
          "security-requirement-extraction"
        ],
        [
          "skill-scanner"
        ],
        [
          "security-and-hardening",
          "protect-mcp-governance"
        ]
      ]
    }
  ],
  "ambiguous": false,
  "provenance": {
    "source": "independent-synthetic-held-out-gold",
    "version": "1.0.0",
    "reviewedAt": "2026-07-17"
  },
  "reviews": [
    {
      "reviewer": "codex-independent-alpha",
      "decision": "approved",
      "reviewedDigest": "sha256-f6b73325636af164a0105041c9766e2f62c0d7a24eba66a2abb09217be9e8c41"
    },
    {
      "reviewer": "codex-independent-beta",
      "decision": "approved",
      "reviewedDigest": "sha256-f6b73325636af164a0105041c9766e2f62c0d7a24eba66a2abb09217be9e8c41"
    }
  ]
}
