{
  "schemaVersion": 1,
  "caseId": "tuning.deployment-devops.ci-cd.library-release-ci",
  "acceptedSolutions": [
    {
      "solutionId": "github-actions-pipeline",
      "allowedSkillIds": [
        "github-actions-advanced"
      ],
      "requiredGroups": [
        [
          "github-actions-advanced"
        ]
      ]
    },
    {
      "solutionId": "provider-neutral-cicd",
      "allowedSkillIds": [
        "ci-cd-and-automation"
      ],
      "requiredGroups": [
        [
          "ci-cd-and-automation"
        ]
      ]
    }
  ],
  "ambiguous": false,
  "reviews": [
    {
      "reviewer": "codex-independent-alpha",
      "decision": "approved",
      "reviewedDigest": "sha256-af025c0bc9f14cbc6f96bb7d2124c0f8a9cbd4a2059a4745ca82d8c296ce5872"
    },
    {
      "reviewer": "codex-independent-beta",
      "decision": "approved",
      "reviewedDigest": "sha256-af025c0bc9f14cbc6f96bb7d2124c0f8a9cbd4a2059a4745ca82d8c296ce5872"
    }
  ],
  "provenance": {
    "source": "independent-synthetic-tuning-gold-authoring",
    "version": "1.0.0",
    "reviewedAt": "2026-07-17"
  }
}
