{
  "schemaVersion": 1,
  "caseId": "heldout.test-qa-automation.unit-component.small-greenfield",
  "acceptedSolutions": [
    {
      "solutionId": "vite-native-vitest",
      "allowedSkillIds": [
        "vitest-skill",
        "javascript-testing-patterns"
      ],
      "requiredGroups": [
        [
          "vitest-skill"
        ],
        [
          "javascript-testing-patterns"
        ]
      ]
    },
    {
      "solutionId": "jest-compatible",
      "allowedSkillIds": [
        "jest-skill",
        "javascript-testing-patterns"
      ],
      "requiredGroups": [
        [
          "jest-skill"
        ],
        [
          "javascript-testing-patterns"
        ]
      ]
    }
  ],
  "ambiguous": false,
  "provenance": {
    "source": "independent-gold-authoring",
    "version": "1.0.0",
    "reviewedAt": "2026-07-17"
  },
  "reviews": [
    {
      "reviewer": "codex-independent-alpha",
      "decision": "approved",
      "reviewedDigest": "sha256-96de6e9d3fe26a4d0ad95adfa59da223c9002341b94e9f2b4051c9bd6ba9f2c4"
    },
    {
      "reviewer": "codex-independent-beta",
      "decision": "approved",
      "reviewedDigest": "sha256-96de6e9d3fe26a4d0ad95adfa59da223c9002341b94e9f2b4051c9bd6ba9f2c4"
    }
  ]
}
