{
  "schemaVersion": 1,
  "caseId": "heldout.test-qa-automation.integration-contract.mature-legacy-migration",
  "acceptedSolutions": [
    {
      "solutionId": "legacy-postman-automation",
      "allowedSkillIds": [
        "postman-collection-generator",
        "postman-newman-automation",
        "testing-qa"
      ],
      "requiredGroups": [
        [
          "postman-collection-generator"
        ],
        [
          "postman-newman-automation"
        ],
        [
          "testing-qa"
        ]
      ]
    },
    {
      "solutionId": "legacy-postman-ci",
      "allowedSkillIds": [
        "postman-collection-generator",
        "newman-cicd-integration",
        "testing-qa"
      ],
      "requiredGroups": [
        [
          "postman-collection-generator"
        ],
        [
          "newman-cicd-integration"
        ],
        [
          "testing-qa"
        ]
      ]
    }
  ],
  "ambiguous": true,
  "provenance": {
    "source": "independent-gold-authoring",
    "version": "1.0.0",
    "reviewedAt": "2026-07-17"
  },
  "reviews": [
    {
      "reviewer": "codex-independent-alpha",
      "decision": "approved",
      "reviewedDigest": "sha256-4c6dfaec12836492208f5d0b585acb93f68e959a3f2859067d86ada2336e3b17"
    },
    {
      "reviewer": "codex-independent-beta",
      "decision": "approved",
      "reviewedDigest": "sha256-4c6dfaec12836492208f5d0b585acb93f68e959a3f2859067d86ada2336e3b17"
    }
  ]
}
