{
  "schemaVersion": 1,
  "caseId": "heldout.agent-mcp-development.memory-context-retrieval.mature-legacy-migration",
  "acceptedSolutions": [
    {
      "solutionId": "reversible-hybrid-retrieval",
      "allowedSkillIds": [
        "rag-engineer",
        "rag-implementation",
        "hybrid-search-implementation",
        "embedding-strategies",
        "deprecation-and-migration",
        "agent-evaluation"
      ],
      "requiredGroups": [
        [
          "rag-engineer",
          "rag-implementation"
        ],
        [
          "hybrid-search-implementation",
          "embedding-strategies"
        ],
        [
          "deprecation-and-migration"
        ],
        [
          "agent-evaluation"
        ]
      ]
    }
  ],
  "ambiguous": false,
  "provenance": {
    "source": "independent-synthetic-held-out-gold",
    "version": "1.0.0",
    "reviewedAt": "2026-07-17"
  },
  "reviews": [
    {
      "reviewer": "codex-independent-alpha",
      "decision": "approved",
      "reviewedDigest": "sha256-a3a765e62ac458b71852ad6e5388f5e0023ca5f92e196a25b9f81b23e757265e"
    },
    {
      "reviewer": "codex-independent-beta",
      "decision": "approved",
      "reviewedDigest": "sha256-a3a765e62ac458b71852ad6e5388f5e0023ca5f92e196a25b9f81b23e757265e"
    }
  ]
}
