{
  "schemaVersion": 1,
  "caseId": "heldout.api-backend-delivery.persistence-data.regulated-high-assurance",
  "acceptedSolutions": [
    {
      "solutionId": "tenant-isolated-relational-model",
      "allowedSkillIds": [
        "saas-multi-tenant",
        "database-design",
        "postgresql",
        "postgres-best-practices",
        "database-migration"
      ],
      "requiredGroups": [
        [
          "saas-multi-tenant"
        ],
        [
          "database-design",
          "postgresql"
        ],
        [
          "postgres-best-practices",
          "database-migration"
        ]
      ]
    }
  ],
  "ambiguous": false,
  "provenance": {
    "source": "independent-synthetic-held-out-gold",
    "version": "1.0.0",
    "reviewedAt": "2026-07-17"
  },
  "reviews": [
    {
      "reviewer": "codex-independent-alpha",
      "decision": "approved",
      "reviewedDigest": "sha256-f5373367ded6b47ce35a6d39d7d9add990ffa3ef20870b32fa9a68eb568b0d7b"
    },
    {
      "reviewer": "codex-independent-beta",
      "decision": "approved",
      "reviewedDigest": "sha256-f5373367ded6b47ce35a6d39d7d9add990ffa3ef20870b32fa9a68eb568b0d7b"
    }
  ]
}
